{
  "assumptions": [
    "formal differential operators over commuting scalar coefficients",
    "formal adjoint ignores boundary terms"
  ],
  "candidate_id": "LaxforgeCalibration2x2Zero",
  "claims": [
    {
      "proof_strategy": "coefficient_certificate",
      "type": "lax_equation"
    },
    {
      "proof_strategy": "coefficient_certificate",
      "type": "self_adjoint_L"
    },
    {
      "proof_strategy": "coefficient_certificate",
      "type": "skew_adjoint_P"
    }
  ],
  "directions": {
    "space": [
      "x"
    ],
    "time": "t"
  },
  "evolution": {
    "p": {
      "field": "p",
      "kind": "jet",
      "order": 1
    },
    "q": {
      "field": "q",
      "kind": "jet",
      "order": 1
    }
  },
  "fields": [
    "p",
    "q"
  ],
  "laxcert_schema_version": "0.1.0",
  "laxcert_target_version": "0.1.0",
  "laxforge_version": "laxforge:0.1.0",
  "operators": {
    "L": {
      "rows": [
        [
          {
            "terms": [
              {
                "coeff": {
                  "field": "p",
                  "kind": "jet",
                  "order": 0
                },
                "order": 0
              }
            ]
          },
          {
            "terms": [
              {
                "coeff": {
                  "kind": "const",
                  "value": 0
                },
                "order": 0
              }
            ]
          }
        ],
        [
          {
            "terms": [
              {
                "coeff": {
                  "kind": "const",
                  "value": 0
                },
                "order": 0
              }
            ]
          },
          {
            "terms": [
              {
                "coeff": {
                  "field": "q",
                  "kind": "jet",
                  "order": 0
                },
                "order": 0
              }
            ]
          }
        ]
      ]
    },
    "P": {
      "rows": [
        [
          {
            "terms": [
              {
                "coeff": {
                  "kind": "const",
                  "value": 1
                },
                "order": 1
              }
            ]
          },
          {
            "terms": [
              {
                "coeff": {
                  "kind": "const",
                  "value": 0
                },
                "order": 0
              }
            ]
          }
        ],
        [
          {
            "terms": [
              {
                "coeff": {
                  "kind": "const",
                  "value": 0
                },
                "order": 0
              }
            ]
          },
          {
            "terms": [
              {
                "coeff": {
                  "kind": "const",
                  "value": 1
                },
                "order": 1
              }
            ]
          }
        ]
      ]
    }
  },
  "provenance": {
    "calibration_target": "2x2 formal differential-operator smoke calibration",
    "exporter": "laxforge.core.laxcert_export.write_laxcert_calibration_artifact",
    "source": "laxforge"
  },
  "scalar_ring": "rat_differential_polynomial",
  "schema_version": "0.1.0"
}
